,Political Affiliation,tweet,Politician,Word Count,negative,neutral,positive,polarity
274,Democrats,Serving as @BarackObama's Vice President was a privilege and an honor. We share the belief that America is a place… https://t.co/6CF3GSSWFN,Joe Biden,21,0.0,0.669,0.331,0.7845
275,Democrats,"Folks, we’re just getting started! I’ll be heading to Iowa next. Visit https://t.co/7Je6uld7qQ for event details an… https://t.co/KJe4sumGT1",Joe Biden,18,0.0,1.0,0.0,0.0
276,Democrats,We must turbocharge our efforts to address climate change that threatens communities across the country. Through cl… https://t.co/fsC2T1s2c2,Joe Biden,18,0.133,0.867,0.0,-0.3818
277,Democrats,"Whether you’re covered through your employer, on your own, or not at all - you should have a choice to buy into a p… https://t.co/2NA2syUZJf",Joe Biden,25,0.0,1.0,0.0,0.0
278,Democrats,The Affordable Care Act was a huge step forward for this country. Now we have to finish the job and make health car… https://t.co/XK3DmRFGmI,Joe Biden,24,0.0,0.792,0.208,0.6705
279,Democrats,By making post-secondary education and training affordable to and making sure the economy works not only for folks… https://t.co/cAycaDNP2G,Joe Biden,19,0.0,0.887,0.113,0.3182
280,Democrats,"Twelve years of education is not enough. In order to rebuild a strong middle class, we must provide skills needed t… https://t.co/b9tBZ5FD4L",Joe Biden,22,0.0,0.858,0.142,0.5106
281,Democrats,We need to get rid of the capital gains loophole for multimillionaires. I’m going to change it so millionaires and… https://t.co/jbct9nS8aV,Joe Biden,21,0.0,0.893,0.107,0.34
282,Democrats,"Companies continue to squeeze every last penny out of workers, making it harder and harder for Americans to make en… https://t.co/6X87JWDqrk",Joe Biden,21,0.0,1.0,0.0,0.0
283,Democrats,This country wasn’t built by Wall Street bankers and CEOs and hedge fund managers. It was built by you. The great A… https://t.co/34VspQIOrt,Joe Biden,23,0.0,0.843,0.157,0.6249
284,Democrats,"As I shared in Pittsburgh today, there are three reasons I’m running for President - to restore the soul of our nat… https://t.co/nqnFmnE6ae",Joe Biden,23,0.0,0.805,0.195,0.5574
285,Democrats,"I'm sick of this President badmouthing unions. Labor built the middle class in this country. Minimum wage, overtime… https://t.co/URYezOoyKw",Joe Biden,19,0.155,0.845,0.0,-0.5106
286,Democrats,I couldn't be more proud to have the International Association of Fire Fighters on my team. Unions built the middle… https://t.co/t8AwKcFor8,Joe Biden,21,0.273,0.727,0.0,-0.6565
287,Democrats,"I've said it before and I'll say it again. To speak to the middle class, we need to reject the super PAC system. Th… https://t.co/06wlnw6nkC",Joe Biden,25,0.091,0.777,0.132,0.296
288,Democrats,Join me in Pittsburgh tomorrow for a discussion on my plan to build a middle class where everyone comes along. RSVP… https://t.co/VGcnFqVmnJ,Joe Biden,22,0.0,0.896,0.104,0.296
289,Democrats,"Iowa, I'm headed to town this week! Let me know you'll join us by RSVPing at https://t.co/NdJwunC2kP https://t.co/8i6GPQKV6x",Joe Biden,18,0.0,0.872,0.128,0.3595
290,Democrats,"Dick Lugar was among the most decent men I have ever known. Kind, loyal, dedicated beyond measure to the service of… https://t.co/vZdm7ikh8M",Joe Biden,22,0.111,0.57,0.319,0.7351
291,Democrats,"Wishing everyone in the Orthodox Christian community a peaceful and joyful Easter celebration with friends, family… https://t.co/vlGCYPGLJG",Joe Biden,17,0.0,0.498,0.502,0.9022
292,Democrats,Jill and I are devastated to hear about today’s shooting at the Chabad Poway synagogue. No one should have to worsh… https://t.co/F9yPJl3UH5,Joe Biden,22,0.246,0.754,0.0,-0.7351
293,Democrats,I have a message for #TeamJoe: Thank you! https://t.co/j61zCaZmDz,Joe Biden,9,0.0,0.682,0.318,0.4199
294,Democrats,I had the privilege to thank one of our grassroots donors. It's because of supporters like Josh we're able to make… https://t.co/M5xOPN5lDr,Joe Biden,22,0.0,0.62,0.38,0.8555
295,Democrats,Thank you to the women of @TheView for the conversation today. It’s always a pleasure to sit down with you at the t… https://t.co/wnIpf89RqU,Joe Biden,24,0.0,0.772,0.228,0.7351
296,Democrats,Looking forward to joining the women of @TheView today for my first live interview since announcing my 2020 campaig… https://t.co/9TOTgOFMFf,Joe Biden,20,0.0,1.0,0.0,0.0
297,Democrats,UPDATE: We’re about to close the books on an AMAZING first day of our campaign. It’s not too late to be a part of i… https://t.co/q91t7sWulS,Joe Biden,26,0.0,0.841,0.159,0.6739
298,Democrats,Our campaign is off to a great start thanks to thousands of Americans who have made donations. If you haven’t had t… https://t.co/nzFAdC7pEH,Joe Biden,23,0.0,0.741,0.259,0.7906
299,Democrats,"Folks, earlier today I announced that I’m running for President of the United States. The strength of this movement… https://t.co/NCty630Sli",Joe Biden,20,0.0,0.739,0.261,0.7184
300,Democrats,"Our country is being put to the test, but I’ve never been more optimistic about America. Together we can do this. M… https://t.co/gYpJhts8oe",Joe Biden,23,0.112,0.888,0.0,-0.4153
301,Democrats,Hoy estoy anunciando mi candidatura para presidente de los Estados Unidos. Somos los Estados Unidos de America - y… https://t.co/yeKkhd0Hop,Joe Biden,20,0.0,1.0,0.0,0.0
302,Democrats,The core values of this nation… our standing in the world… our very democracy...everything that has made America --… https://t.co/1a3Gvi2tBY,Joe Biden,20,0.0,0.876,0.124,0.4019
303,Democrats,"The hard working men and women of @UFCW that I met today are going without pay during this strike. If you can, pitc… https://t.co/y0dAiiBQpu",Joe Biden,24,0.12,0.827,0.054,-0.1541
304,Democrats,My wife Jill always reminds me that any country that out-educates us will out-compete us. Our teachers must have th… https://t.co/YPUOUjstxn,Joe Biden,21,0.0,1.0,0.0,0.0
305,Democrats,"I'm on my way up to a rally at #StopandShop in Boston to stand with some of the 31,000 @UFCW union members who are… https://t.co/kFHGQT3Bk5",Joe Biden,25,0.0,1.0,0.0,0.0
306,Democrats,"For centuries, Notre Dame Cathedral has withstood wars, revolutions, and the test of time. It is a symbol of faith… https://t.co/ei5nxUVHyb",Joe Biden,21,0.159,0.841,0.0,-0.5574
307,Democrats,This is powerful. I would encourage everyone to read and take to heart Kyle’s message on privilege. https://t.co/Kceif5wFvg,Joe Biden,18,0.0,0.619,0.381,0.8225
308,Democrats,"In the last 5 years, @StopandShop's parent company has bought back billions of dollars in stock. Now they want to c… https://t.co/3jTtJLsVBT",Joe Biden,22,0.0,0.939,0.061,0.0772
309,Democrats,https://t.co/WiA0Ux3aYE,Joe Biden,1,0.0,1.0,0.0,0.0
310,Democrats,"I see that you are on the job and presidential, as always. https://t.co/j7wh3opXOv",Joe Biden,13,0.0,1.0,0.0,0.0
311,Democrats,"Social norms are changing. I understand that, and I’ve heard what these women are saying. Politics to me has always… https://t.co/OGubjbOniI",Joe Biden,21,0.0,1.0,0.0,0.0
312,Democrats,Stoning people to death for homosexuality or adultery is appalling and immoral. Every single person on earth is ent… https://t.co/JXWAPfDPji,Joe Biden,20,0.356,0.644,0.0,-0.8555
313,Democrats,.@NRA opposition to a full reauthorization of the Violence Against Women Act is sickening. We must do more to prote… https://t.co/ie1j31BcVo,Joe Biden,21,0.294,0.706,0.0,-0.8176
314,Democrats,"Whether on the assembly line, at the grocery store checkout, or in the boardroom, every woman deserves to make ever… https://t.co/2HxA2G7YbN",Joe Biden,21,0.0,1.0,0.0,0.0
315,Democrats,I was honored to meet Vlad and Adrianna tonight at the #BidenCourageAwards. These young people exemplify what… https://t.co/T5QtaxLWiM,Joe Biden,18,0.0,0.808,0.192,0.5859
316,Democrats,I’m proud of my alma mater @UDelaware &amp; the student organizers of @UDance for their commitment to fighting childhoo… https://t.co/7hYZObi4wj,Joe Biden,20,0.099,0.675,0.226,0.4939
317,Democrats,The people of Guatemala should be the ones to choose their next president. The stakes are high: promoting transpare… https://t.co/QCHACt6H4l,Joe Biden,20,0.0,0.884,0.116,0.3612
318,Democrats,Silence is complicity. Our children are listening. The time to speak out is now.,Joe Biden,14,0.0,1.0,0.0,0.0
319,Democrats,"Whether it is antisemitism in Pittsburgh, racism in Charlottesville, or the xenophobia and Islamophobia today in Ch… https://t.co/azt7hJ8Th5",Joe Biden,18,0.194,0.806,0.0,-0.6249
320,Democrats,"On behalf of Jill, myself, and all of the Bidens, our hearts go out to the community in Christchurch suffering from… https://t.co/65qquBgRDc",Joe Biden,22,0.129,0.871,0.0,-0.4767
321,Democrats,"No one should live in fear of being fired, evicted from their home, or denied service in a restaurant just because… https://t.co/viPEa45s2V",Joe Biden,22,0.412,0.588,0.0,-0.8979
322,Democrats,https://t.co/SOZ9EUh854,Joe Biden,1,0.0,1.0,0.0,0.0
323,Democrats,"Joe Boardman led @Amtrak through difficult times, taking over during the worst economic crisis since the Depression… https://t.co/xBdQgaKuMu",Joe Biden,18,0.416,0.584,0.0,-0.8934
324,Democrats,"Each year on International Women’s Day, we reaffirm the straightforward truth that achieving the goal of full and e… https://t.co/IydEGvR7gx",Joe Biden,20,0.0,0.892,0.108,0.3182
325,Democrats,"@CynthiaNixon You’re right, Cynthia. I was making a point in a foreign policy context, that under normal circumstan… https://t.co/z7sb1rrgER",Joe Biden,19,0.0,1.0,0.0,0.0
326,Democrats,Notes are ready. Be sure to tune in at 3pm ET when I will sit down at @UDBidenSchool with author and historian… https://t.co/VU9fRmBFeW,Joe Biden,23,0.0,0.806,0.194,0.5859
327,Democrats,"Foreign election interference is not only a serious threat to our democratic institutions, it’s a threat to our nat… https://t.co/DLMObD35vG",Joe Biden,20,0.0,0.689,0.311,0.6979
328,Democrats,Today I congratulated President @IvanDuque on his successful visit to Washington. Maintaining strong bipartisan sup… https://t.co/iFTDi7GJFw,Joe Biden,16,0.0,0.647,0.353,0.7964
329,Democrats,"Stand with survivors and advocates like @nguyen_amanda, @ZerlinaMaxwell, @ruthmglenn, @DavidsonJess22, @Mariska, an… https://t.co/uGzpJDxSTS",Joe Biden,13,0.0,0.828,0.172,0.3612
330,Democrats,"There is nothing more powerful that Congress can do to help women, strengthen families, and save lives than reauthorizing VAWA. Now.",Joe Biden,21,0.092,0.613,0.296,0.686
331,Democrats,VAWA’s power is that it gets stronger with each reauthorization. This year can be no different. Like was done in 20… https://t.co/WrSYEP9uwE,Joe Biden,22,0.084,0.722,0.194,0.4404
332,Democrats,"One in five women will still be victims of rape or attempted rape in their lifetimes. On average, three women a day… https://t.co/LjNJLqoqb1",Joe Biden,23,0.381,0.619,0.0,-0.9136
333,Democrats,"Since the passage of VAWA, annual rates of domestic violence have dropped by 63%. The National Domestic Violence Ho… https://t.co/VvN5mgmPEt",Joe Biden,20,0.313,0.687,0.0,-0.8481
334,Democrats,"When I wrote the Violence Against Women Act in 1994, I believed it would be a lifeline. But this Congress has turne… https://t.co/UZbNYJLtD3",Joe Biden,23,0.177,0.823,0.0,-0.6249
335,Democrats,I know from personal experience the only way to overcome grief is to find purpose. The Parkland students &amp; families… https://t.co/T946o7aKPg,Joe Biden,21,0.144,0.856,0.0,-0.4939
336,Democrats,"One year after the tragic massacre in Parkland, we’ve not done nearly enough to ensure this will never happen again… https://t.co/ZLhMxJAXJL",Joe Biden,21,0.122,0.772,0.106,-0.1027
337,Democrats,Only a tyrant would prevent the delivery of food and medicine to people he claims to lead. The international commun… https://t.co/2ozfg0dYUM,Joe Biden,21,0.0,0.945,0.055,0.0258
338,Democrats,John Dingell was the Dean of the House. He earned that title — not just because he was there the longest — but beca… https://t.co/2w5dAwu1EB,Joe Biden,25,0.0,1.0,0.0,0.0
339,Democrats,Stacey Abrams achieved in a matter of minutes something Donald Trump failed to do in over an hour -- to embrace and… https://t.co/90Zap1XMld,Joe Biden,23,0.128,0.739,0.132,-0.2263
340,Democrats,Today far too many transgender youth continue to face rejection at home and discrimination in their communities. Ch… https://t.co/V89ijHIF88,Joe Biden,19,0.163,0.837,0.0,-0.5423
341,Democrats,There is no place for racism in America. Governor Northam has lost all moral authority and should resign immediatel… https://t.co/trGjj2DPKs,Joe Biden,20,0.403,0.549,0.048,-0.8658
342,Democrats,This country is built on the courage of ordinary Americans who stand up for what’s right. I couldn’t be prouder to… https://t.co/tn9zcv9Pfg,Joe Biden,22,0.0,0.748,0.252,0.7506
343,Democrats,"Through the #HandsOffIX website, @endrapeoncampus,@knowyourIX have helped thousands make their voices heard in the… https://t.co/YbjiSD0fR7",Joe Biden,15,0.0,1.0,0.0,0.0
344,Democrats,Fellow @UDelaware Blue Hen @Sage_Gaea of @knowyourIX has done so much for the students of Delaware through her advo… https://t.co/McTEgQJfJd,Joe Biden,20,0.0,1.0,0.0,0.0
345,Democrats,.@DavidsonJess22 of @endrapeoncampus has been advocating for safer campuses since long before I met her in the Whit… https://t.co/rtsSIWuXBm,Joe Biden,19,0.0,0.859,0.141,0.4215
346,Democrats,Students and survivors are making their voices heard. Grassroots organizers are working to make sure these guidelin… https://t.co/Q6OhJPskj9,Joe Biden,18,0.0,0.881,0.119,0.3182
347,Democrats,This week @bidenfoundation submitted a comment to the Department of Education about proposed changes to #TitleIX gu… https://t.co/rkyJKS2yNB,Joe Biden,18,0.0,1.0,0.0,0.0
348,Democrats,What happened today to @JussieSmollett must never be tolerated in this country. We must stand up and demand that we… https://t.co/GcyOxwN4IK,Joe Biden,21,0.07,0.93,0.0,-0.128
349,Democrats,https://t.co/iYah5x11To,Joe Biden,1,0.0,1.0,0.0,0.0
350,Democrats,https://t.co/iYah5x11To,Joe Biden,1,0.0,1.0,0.0,0.0
351,Democrats,An untested rape kit means a survivor without justice. I wrote the first rape kit backlog law because every survivo… https://t.co/WgUS1RUu1i,Joe Biden,21,0.41,0.505,0.084,-0.8928
352,Democrats,The spirit of Dr. King is still with us. It has burrowed deep into the soul of this nation. It will not let us rest… https://t.co/Mdy4smJnPx,Joe Biden,26,0.0,0.936,0.064,0.1779
353,Democrats,"Congratulations to the two women who led the way: @RepLonghurst and @HansenForSenate, as well as all of the lawmake… https://t.co/OCDvn3VvGK",Joe Biden,20,0.0,0.75,0.25,0.7184
354,Democrats,"“Equality of rights under the law shall not be denied or abridged on account of sex.” 

Another step forward for eq… https://t.co/8SN8aeZkxz",Joe Biden,22,0.0,0.897,0.103,0.3412
355,Democrats,"White supremacists and their shameful ideology should have no place in this country in 2019, let alone a voice of s… https://t.co/aSc0XfRLhz",Joe Biden,22,0.356,0.644,0.0,-0.8126
356,Democrats,"I know I’m a little biased, but this post from Jill @DrBiden in the #BidenForum is a must-read. Her story of the st… https://t.co/7n5rXLOR8V",Joe Biden,24,0.066,0.934,0.0,-0.1036
357,Democrats,It is clear this administration has abandoned those core American beliefs. Secretary Mattis’ presence and his voice… https://t.co/jewIhgwsqM,Joe Biden,18,0.139,0.741,0.12,-0.1027
358,Democrats,"I’ve had disagreements with Secretary Mattis, but we shared the view — long-held by Democrats and Republicans in th… https://t.co/Pi8pOSSic5",Joe Biden,20,0.086,0.773,0.141,0.296
359,Democrats,"Friends don't let friends go uninsured. If you still need health insurance for 2019, tomorrow, December 15th, is th… https://t.co/TPENNxScon",Joe Biden,20,0.108,0.761,0.131,0.1396
360,Democrats,"This summer, the @bidenfoundation asked you to share stories about the importance of family and community acceptanc… https://t.co/0FyxOldlA7",Joe Biden,18,0.0,0.773,0.227,0.5719
361,Democrats,Now that’s more like it. https://t.co/w34Lo9Ods3,Joe Biden,6,0.0,0.642,0.358,0.4201
362,Democrats,"President George H.W. Bush was a decent, kind, and gracious statesman. This nation will miss him. Our condolences g… https://t.co/aPbiY1Iki6",Joe Biden,20,0.065,0.65,0.285,0.7506
363,Democrats,"Grateful for the time spent with loved ones this Thanksgiving, and grateful for the sacrifice of those military fam… https://t.co/ztdCj2Ew5R",Joe Biden,20,0.0,0.632,0.368,0.872
364,Democrats,Betsy DeVos’ new Title IX rules will discourage sexual assault reporting and investigations. When 1 in 5 women expe… https://t.co/F6Yx7Dl793,Joe Biden,20,0.292,0.708,0.0,-0.765
365,Democrats,"The fires continue to burn in California, and our firefighters are among those who are losing everything. Right now… https://t.co/5t6yR5eIBU",Joe Biden,20,0.12,0.88,0.0,-0.3818
366,Democrats,"Instead of saying every legal vote should be counted in Florida, Republicans have adopted a strategy to discredit t… https://t.co/6l3Y0Dins5",Joe Biden,20,0.0,0.923,0.077,0.128
367,Democrats,Congratulations to @kyrstensinema for a well-earned victory tonight. She’s going to do incredible work for Arizona.… https://t.co/KRGmTCZYif,Joe Biden,17,0.0,0.794,0.206,0.5994
368,Democrats,Every military family knows what it means to sacrifice. Every individual life and story matters. It is who we are a… https://t.co/yJHhASO23l,Joe Biden,22,0.0,0.95,0.05,0.0258
369,Democrats,It’s the most fundamental American right: the right to vote — and for your vote to be counted. Count all the votes… https://t.co/n5kmQKwPO3,Joe Biden,23,0.0,1.0,0.0,0.0
370,Democrats,There's still time to take this election into your own hands. Don't regret what you could have done—take action rig… https://t.co/S2U0TmV7L2,Joe Biden,21,0.0,0.896,0.104,0.3252
371,Democrats,"No better time to help get out the vote than right now—whether you have a lunch break or a few hours to spare, take… https://t.co/ygpW38cYDL",Joe Biden,25,0.079,0.719,0.201,0.5267
372,Democrats,"So let's do this. Get out there and vote today. Here's an easy place to confirm where you can vote, check voting ho… https://t.co/xPo7WkkMJw",Joe Biden,24,0.0,0.888,0.112,0.4404
373,Democrats,"Today is #ElectionDay, and this election is bigger than politics. Today we have a chance to reclaim our American id… https://t.co/fjrULIDYxm",Joe Biden,21,0.0,0.905,0.095,0.25
374,Democrats,"The work we began that night ten years ago in Grant Park is unfinished. 

If you still believe, as I do, that hope… https://t.co/Dh1UGRktH1",Joe Biden,24,0.0,0.898,0.102,0.3612
375,Democrats,"You don’t need to be a Vice President or a podcast star to to make a difference in this election. 

Volunteer now,… https://t.co/ATizT0heuH",Joe Biden,23,0.0,1.0,0.0,0.0
376,Democrats,"Voting restrictions in Georgia weren’t meant to protect the sanctity of our vote, but to suppress turnout. I applau… https://t.co/CVNbvKQyK5",Joe Biden,20,0.0,0.909,0.091,0.2023
377,Democrats,"The character of our country is on the ballot on Tuesday, but you still have a chance to make a difference today. D… https://t.co/CXrVTZwbtf",Joe Biden,24,0.0,0.894,0.106,0.3612
378,Democrats,I couldn’t be more excited to close out this election in Luzerne County PA on Sunday at a Get Out the Vote rally wi… https://t.co/xNvpuk23Vd,Joe Biden,25,0.0,0.891,0.109,0.4005
379,Democrats,"This Thursday evening I’ll be in Lansing, Michigan to support @ElissaSlotkin, Debbie @Stabenow, @GretchenWhitmer an… https://t.co/hBfkMbzTPP",Joe Biden,16,0.0,0.847,0.153,0.4019
380,Democrats,"We can’t leave a single vote on the table, and we’ve got to do everything in our power to re-elect fantastic public… https://t.co/b2IlnkGKtd",Joe Biden,23,0.048,0.806,0.145,0.5267
381,Democrats,"I'm proud to support @Kelly4SouthrnIL. Brendan is tough, independent, and honest—the kind of leader and public serv… https://t.co/ApzyKkEQVG",Joe Biden,18,0.067,0.673,0.26,0.6486
382,Democrats,I'll be in Cedar Rapids tomorrow with @Abby4Iowa and @FredHubbell to rally Iowans around reclaiming our democracy.… https://t.co/XKx97yEZGO,Joe Biden,18,0.0,1.0,0.0,0.0
383,Democrats,Ohio needs a champion—a Governor with a back bone—and that’s @RichCordray. He’s ready to fight for working families… https://t.co/H4FbYmApmt,Joe Biden,19,0.129,0.746,0.124,-0.0258
384,Democrats,"We desperately need men and women of character in elected office. That's why next Tuesday, one week out from Electi… https://t.co/n1Ol9wFsKG",Joe Biden,21,0.115,0.885,0.0,-0.3818
385,Democrats,"Together, we can take this country back. That's why I'm heading to Hartford on Friday in support of @NedLamont and… https://t.co/eFMBj8O9zC",Joe Biden,21,0.0,0.881,0.119,0.4019
386,Democrats,"What an honor to be joined by @Alyssa_Milano on tonight’s #ItsOnUs student organizing call. Alyssa, your courage re… https://t.co/Mz3GEKLbH5",Joe Biden,19,0.0,0.726,0.274,0.7506
387,Democrats,"This country has to come together. This division, this hatred, this ugliness has to end.",Joe Biden,15,0.419,0.581,0.0,-0.8853
388,Democrats,"Cancer patients own their data, not hospitals. #CountMeIn empowers patients to contribute their data for research.… https://t.co/HDZtyMrXBw",Joe Biden,17,0.216,0.784,0.0,-0.6597
389,Democrats,"Our basic American values are under assault. But we can take this country back if we show up and vote. 

That's why… https://t.co/1jGD9qwI2a",Joe Biden,23,0.138,0.764,0.098,-0.2732
390,Democrats,"20 years have passed since the murder of young Matthew Shepard. We've come a long way, thanks to organizations like… https://t.co/wfXB012Q7Y",Joe Biden,21,0.184,0.703,0.113,-0.4215
391,Democrats,"Joe Tydings and I were both inspired by JFK &amp; RFK and their call to service. In the Senate, he lived up to their ex… https://t.co/wxQvx38bg3",Joe Biden,26,0.0,0.882,0.118,0.4939
392,Democrats,"Jason - public service takes many forms, and bravely stepping forward today is exactly that. By sharing your story,… https://t.co/pjVhfsrRRM",Joe Biden,20,0.0,0.736,0.264,0.7269
393,Democrats,Dr. James Allison and Dr. Tasuku Honjo’s immunotherapy discovery uses our own body’s defenses to destroy cancer. To… https://t.co/ORClwSYwzD,Joe Biden,19,0.309,0.625,0.066,-0.802
394,Democrats,Stopped by @UDelaware and @Penn today for #NationalVoterRegistrationDay. You have the power to change the course of… https://t.co/0uRcEo6TnR,Joe Biden,18,0.101,0.899,0.0,-0.2263
395,Democrats,Macedonia will soon hold a referendum on whether to endorse a historic accord with Greece that will pave the way fo… https://t.co/Xucfupu2Ii,Joe Biden,22,0.0,0.892,0.108,0.3182
396,Democrats,Today we are hosting the #BidenCancerSummit in Washington DC and in over 450 communities around the world to bring… https://t.co/kLP6vXaGWL,Joe Biden,20,0.0,1.0,0.0,0.0
397,Democrats,"In the wake of darker moments in our history, our spirit has become mightier. The bonds that unite us have become t… https://t.co/fW8SfUCOgy",Joe Biden,23,0.0,0.928,0.072,0.1779
398,Democrats,"Before we vote this fall in the most consequential election of any of our lifetimes, I want us to have a real discu… https://t.co/OmEAWetMPc",Joe Biden,24,0.0,0.942,0.058,0.0772
399,Democrats,Inspiring words from @BarackObama today.  A powerful reminder that it's on all of us to vote this fall if we want l… https://t.co/votllg5OdQ,Joe Biden,23,0.0,0.734,0.266,0.7096
400,Democrats,"If there was ever a time for a change of pace, it is now. I recommend giving Michael’s new podcast a listen. https://t.co/Ju2AgDdohi",Joe Biden,23,0.0,0.776,0.224,0.5994
401,Democrats,Organized labor is why we have a minimum wage in this country. It’s why we have the five-day work week. It’s why we… https://t.co/MtEs9s2qHi,Joe Biden,24,0.0,1.0,0.0,0.0
402,Democrats,Guatemalan President Jimmy Morales’s decision to end CICIG’s mandate represents a serious blow to anti-corruption e… https://t.co/2YqPt9mLdT,Joe Biden,17,0.08,0.92,0.0,-0.0772
403,Democrats,I will be in Phoenix tomorrow to pay tribute to my friend John. If you are in town and would like to honor his lega… https://t.co/vi7fMMoa4N,Joe Biden,26,0.045,0.671,0.284,0.8176
404,Democrats,"John McCain was many things – a proud graduate of the Naval Academy, a Senate colleague, a political opponent. 

Bu… https://t.co/rV0aXV25Y5",Joe Biden,21,0.0,0.838,0.162,0.4767
405,Democrats,"Leonard and Dody Boswell lived their lives in service to the people of Iowa, and for the last 63 of those years, in… https://t.co/sINQwxlf5v",Joe Biden,24,0.0,1.0,0.0,0.0
406,Democrats,"We’re in the midst of an all-out assault on human dignity—yes, at the border, but also in the courtroom, in the cla… https://t.co/5JSwkyZRQh",Joe Biden,23,0.098,0.902,0.0,-0.34
407,Democrats,Kofi Annan knew that human beings acting together could make the world better. He dedicated his life to that belief… https://t.co/vbBeVwMQlb,Joe Biden,21,0.0,0.763,0.237,0.7096
408,Democrats,The team @LombardiCancer has just made a valuable database of brain cancer biomedical data freely available to rese… https://t.co/3YtWZF4ei5,Joe Biden,19,0.173,0.591,0.236,0.1531
409,Democrats,Aretha Franklin was so much more than a great entertainer. She inspired. She gave hope. She was part of the soul of… https://t.co/EgAp6rseSU,Joe Biden,23,0.0,0.574,0.426,0.9238
410,Democrats,"In the time I have known him, John Brennan has never been afraid to speak up and give it to you straight. Revoking… https://t.co/XrDnOpld0F",Joe Biden,24,0.0,0.921,0.079,0.2263
411,Democrats,"Today we honor the memory of Heather Heyer, whose spirit we see in every person who stands up to reject hatred and… https://t.co/DTVL5ZCzwR",Joe Biden,23,0.224,0.617,0.159,-0.4588
