Political Affiliation,tweet,Politician,Word Count,created_time
Democrats,"VP Biden: For women, ""the picture is becoming more clear"" after last night's debate. http://t.co/rofkNnVt",Joe Biden,15,2012-10
Democrats,President Obama stood up for you tonight—now it’s your turn. Commit to vote: http://t.co/8zZedMuS #TeamBarack,Joe Biden,15,2012-10
Democrats,"OFA Campaign Manager Jim Messina on why @BarackObama ""clearly won tonight's debate"": http://t.co/cMTlxZug",Joe Biden,13,2012-10
Democrats,"If you’re proud of President Obama after tonight’s debate, add your name: http://t.co/p1MpprMZ #TeamBarack",Joe Biden,14,2012-10
Democrats,"President Obama: ""We are on pace to double our exports. That's creating tens of thousands of jobs all across the country."" #TeamBarack",Joe Biden,22,2012-10
Democrats,"President Obama: ""We have made sure that millions of young people are able to get an education when they weren't able to before.""",Joe Biden,23,2012-10
Democrats,Romney invested in a Chinese firm after learning it would “not be subject to taxes in the United States.” http://t.co/mC3S0gS7 #SketchyDeal,Joe Biden,21,2012-10
Democrats,"Romney’s energy plan would do nothing for energy independence,  and risks destroying thousands of jobs: http://t.co/QSF0CSUS #RealRomney",Joe Biden,17,2012-10
Democrats,FACT: Romney’s only solution to lower gas prices is to drill for more oil—yet he opposes vehicle standards that will save money at the pump.,Joe Biden,25,2012-10
Democrats,Time to tune in! The second presidential debate starts in a few minutes. http://t.co/p1MpprMZ #TeamObamaBiden,Joe Biden,15,2012-10
Democrats,Why Romney’s tax plan just doesn’t add up: http://t.co/nU5wb8sy #MittMath,Joe Biden,10,2012-10
Democrats,"""Arithmetic over illusion"": What Romney's tax plan really means for the middle class. http://t.co/3xZSpdO0 #MittMath",Joe Biden,15,2012-10
Democrats,“Let's show Barack what kind of grassroots organization he's got behind him—one that's ready for whatever comes ahead.” http://t.co/StDO9nR3,Joe Biden,19,2012-10
Democrats,"La Crosse, Wisconsin was fired up for VP Biden and Dr. Biden last week: http://t.co/i00yLvGE",Joe Biden,15,2012-10
Democrats,VP: “What’s at stake for the Latino community this election is the dreams &amp; aspirations of their fathers and mothers.” http://t.co/WKhiOmrE,Joe Biden,21,2012-10
Democrats,"Dr. Biden gets North Carolinians excited for early voting, which kicks off in just 3 days (cc @OFA_NC). http://t.co/o4mcu8tf",Joe Biden,19,2012-10
Democrats,"Pitch in $10, get a car magnet—it’s that easy: http://t.co/XEfJ0uhp",Joe Biden,10,2012-10
Democrats,"In 1994, then-Sen. Biden wrote a letter to an 8th grader—and changed his life. Check it out: http://t.co/sBTcge4Q",Joe Biden,18,2012-10
Democrats,"Crisscrossing the country with VP Biden, President Obama, and the First Lady on the road to November 6th: http://t.co/ynfR8B0L",Joe Biden,19,2012-10
Democrats,VP Biden responds to Romney and Ryan writing off half the American people: http://t.co/ELNelq24,Joe Biden,14,2012-10
Democrats,Romney and Ryan have been spreading misinformation about Medicare. Get the facts from VP Biden: http://t.co/bOHUnNoJ,Joe Biden,16,2012-10
Democrats,"Big cheers for VP Biden and Dr. Jill Biden in La Crosse, Wisconsin yesterday: http://t.co/Zrk0dlp3",Joe Biden,15,2012-10
Democrats,“I think Joe Biden rocks.” Hundreds of supporters called in to congratulate the VP on his debate win—have a listen: http://t.co/U4FvwCTm,Joe Biden,21,2012-10
Democrats,Worth a re-watch: VP Biden talks in last night's debate about why we've got to give the middle class a fair shot. http://t.co/oDRrudwg,Joe Biden,23,2012-10
Democrats,.@BeauBiden: Paul Ryan “left the door wide open” for putting additional troops in Afghanistan. http://t.co/FU2Is0yl,Joe Biden,15,2012-10
Democrats,Now it’s your turn to talk—call 312.985.6433 and leave a message to let Joe know how you thought he did in last night’s debate.,Joe Biden,24,2012-10
Democrats,The Romney-Ryan strategy? Hiding the truth on plans that hurt the middle class. http://t.co/CKCKD4pi,Joe Biden,14,2012-10
Democrats,".@ChrisVanHollen: “What you saw was the passionate Joe Biden, the Joe Biden who fights for the middle class.” http://t.co/4n3sFaZG",Joe Biden,19,2012-10
Democrats,The reviews are in—see what others are saying about VP Biden's win last night: http://t.co/2oaMJRjH,Joe Biden,15,2012-10
Democrats,A woman’s health decisions are up to her and her doctor—no one else: http://t.co/flU5meBU,Joe Biden,14,2012-10
Democrats,Straight talk on taxes from VP Biden: http://t.co/FRSTOJze,Joe Biden,8,2012-10
Democrats,Tonight you heard the other side’s plan to take us back to the failed policies of the past. We can't go back. We've gotta go forward. –Joe,Joe Biden,27,2012-10
Democrats,"If you like what you heard from VP Biden tonight, say you're in here: http://t.co/iJK2hy1C",Joe Biden,15,2012-10
Democrats,"VP: ""Look at my record—it’s been all about the middle class. They’re the people who grow this country."" #TeamJoe",Joe Biden,19,2012-10
Democrats,Our solemn obligation to veterans: http://t.co/YjcVT7FF,Joe Biden,6,2012-10
Democrats,"""If you notice, he never answers the question.""—VP Biden #DetailsMatter",Joe Biden,10,2012-10
Democrats,"VP on Afghanistan: ""We will leave in 2014.""",Joe Biden,8,2012-10
Democrats,"The Romney-Ryan plan: They call it “gutsy”—we call it a disaster for the middle class. http://t.co/yxL6DkGo, http://t.co/9vRedMyH",Joe Biden,17,2012-10
Democrats,"VP: ""A simple answer: He's raising the cost of Medicare."" #FactsMatter",Joe Biden,11,2012-10
Democrats,Team Obama-Biden is strengthening Medicare. Romney and Ryan would turn it into vouchercare: http://t.co/sBRJLvXH,Joe Biden,14,2012-10
Democrats,Take a look at the Romney-Ryan budget plan to see what they value (and what they don’t): http://t.co/yxL6DkGo,Joe Biden,18,2012-10
Democrats,"""Iran is more isolated today than when we took office."" —VP Biden",Joe Biden,12,2012-10
Democrats,"VP: ""(The President) is a guy who has done everything he said he would do.""",Joe Biden,15,2012-10
Democrats,It’s go time: Tune in to http://t.co/xxwISX80 http://t.co/013Ok5z1,Joe Biden,8,2012-10
Democrats,Barack and I are in this because we'll never stop fighting for you. You’ll see that tonight. –Joe,Joe Biden,18,2012-10
Democrats,“My promise to you and Barack tonight”: http://t.co/CSUpnlDD,Joe Biden,8,2012-10
Democrats,"Wheels down in Lexington, Kentucky: http://t.co/gQFAJH5w",Joe Biden,6,2012-10
Democrats,"For live fact-checks, notable quotes, and infographics, follow @Obama2012 and @OFADebates during and after tonight’s debate.",Joe Biden,16,2012-10
Democrats,“Paul Ryan and his many methods of misrepresentation”: http://t.co/jjJHbJ3Z,Joe Biden,9,2012-10
Democrats,Joe photo of the day: prepping for tonight’s debate. http://t.co/Es4vkZ8n,Joe Biden,10,2012-10
Democrats,"Check out our livestream of the VP debate tonight for exclusive coverage, starting at 9pm ET: http://t.co/Kh7OV6WJ",Joe Biden,17,2012-10
Democrats,Get to know Joe a little better before tomorrow's vice presidential debate: http://t.co/hPl81xG0,Joe Biden,13,2012-10
Democrats,"Rep. @ChrisVanHollen previews VP Biden's debate against ""a ticket that is willing to say anything to get elected."" http://t.co/IHi6LRss",Joe Biden,19,2012-10
Democrats,Paul Ryan’s last major speech was called “stunning for its dishonesty.” Tune in to see if he’ll be honest tomorrow: http://t.co/UzMQYhfw,Joe Biden,21,2012-10
Democrats,The only way someone like Mitt Romney beats someone like Barack Obama is if we don't step it up when it really matters: http://t.co/KYf7SSPt,Joe Biden,24,2012-10
Democrats,“Barack and I cannot do this alone. We need you and it's always been that way.” http://t.co/cm25fj3D,Joe Biden,17,2012-10
Democrats,"Before VP Biden debates Rep. Ryan on Thursday, make sure everyone you know has the facts on where they stand: http://t.co/Pa99hjnM",Joe Biden,21,2012-10
Democrats,Dr. Biden rallied supporters around Pennsylvania yesterday: http://t.co/fCFSNl1j,Joe Biden,8,2012-10
Democrats,The voter registration deadline is today in several states. Make sure your vote counts this fall: http://t.co/zN5sHHM8,Joe Biden,17,2012-10
Democrats,"If you heart Joe, say it here: http://t.co/E9hPs7lH http://t.co/ZKoib1Ks",Joe Biden,9,2012-10
Democrats,VP Biden reflects on President Obama’s unwavering commitment to veterans: http://t.co/oRVu0Zn0,Joe Biden,11,2012-10
Democrats,Voter registration deadlines are coming up in many states. Make sure your vote gets counted: http://t.co/FXrlhdS6,Joe Biden,16,2012-10
Democrats,An inside look at the campaign trail on the Road to November 6th: http://t.co/CqYZ8ZaC,Joe Biden,14,2012-10
Democrats,Are you registered to vote at your current address? Make sure: http://t.co/JUVAN8RS,Joe Biden,12,2012-10
Democrats,Tax experts agree: Romney’s math just doesn’t add up. http://t.co/0UqgyBrY,Joe Biden,10,2012-10
Democrats,"Photo of the day: VP Biden talks to a 91-year-old WWII vet in Council Bluffs, IA. http://t.co/1IUBrRb3",Joe Biden,17,2012-10
Democrats,“The American people are so much better—so much stronger—take so much more responsibility than these guys give them credit for.”—VP in IA,Joe Biden,22,2012-10
Democrats,"VP Biden on Romney-Ryan: “Ladies and gentlemen, these guys don't get it. There is no quit in America.”",Joe Biden,18,2012-10
Democrats,"“We're going to give tax breaks to companies that invest in America, not invest overseas. We're going to cut our oil imports by half.”",Joe Biden,24,2012-10
Democrats,"VP Biden on the GOP: “Their policies put the middle class in a deep hole, which we’ve been helping them climb out of for the last 4 years.”",Joe Biden,28,2012-10
Democrats,"VP in IA: “Can you imagine Barack Obama signing &amp; being for a plan that would raise by $6,400 a year the cost of Medicare?” Audience: “No!”",Joe Biden,27,2012-10
Democrats,VP on Romney: “He didn’t tell you much about his plan. He didn’t say much about what his plan does. And a lot of it just doesn’t add up.”,Joe Biden,29,2012-10
Democrats,"“Since President Obama has been elected President and changed the law, Medicare recipients have more benefits.”—VP Biden in Iowa",Joe Biden,19,2012-10
Democrats,VP Biden on Romney-Ryan: “They don’t tell you what they are for anymore. And they deliberately misrepresent what they say we are for.”,Joe Biden,23,2012-10
Democrats,"“He put forward a clear, specific plan on how to get this country moving forward again.”—VP Biden on President Obama in last night’s debate",Joe Biden,24,2012-10
Democrats,"VP in Iowa: “You have early voting in this state. It’s already underway. You don’t have to wait till Election Day, so elect us today.”",Joe Biden,25,2012-10
Democrats,In case you missed it: Check out VP Biden’s take on last night’s debate. http://t.co/5X176iC9,Joe Biden,15,2012-10
Democrats,President Obama has a specific plan for strengthening the middle class—pass it on: http://t.co/U3HgpG46,Joe Biden,14,2012-10
Democrats,"Fact check: Rommey's debate performance was ""mostly fictional."" http://t.co/05MftQ2v",Joe Biden,9,2012-10
Democrats,"If you’re standing with President Obama tonight, be sure to register to vote. It takes less than 5 minutes: http://t.co/r4DkSsby",Joe Biden,20,2012-10
Democrats,"Folks, I hope you saw what I saw tonight: President Obama's the choice to move us forward, not back. –Joe",Joe Biden,20,2012-10
Democrats,"To Barack: Good luck tonight, and happy anniversary to you and Michelle. –Joe and Jill",Joe Biden,15,2012-10
Democrats,Livestream coverage of tonight’s debate kicks off at 9pm ET—with a special message from the VP following the debate: http://t.co/R3ZVHaVQ,Joe Biden,20,2012-10
Democrats,North Carolina was all smiles for VP Biden yesterday: http://t.co/Zy1CHnmY,Joe Biden,10,2012-10
Democrats,“Keep the faith”: http://t.co/QUdeHeWP http://t.co/mdUnSWcI,Joe Biden,5,2012-10
Democrats,Happy debate day! There’s still time to find a watch party near you: http://t.co/HoXeY1e2,Joe Biden,14,2012-10
Democrats,Be the first to hear from VP Biden after the debate tomorrow night—find a watch party in your community: http://t.co/5UzascjI,Joe Biden,20,2012-10
Democrats,"From Carson City to Charlottesville, President Obama’s policies are having positive effects across the country: http://t.co/5udViQtP",Joe Biden,16,2012-10
Democrats,“We will fulfill the only truly sacred obligation we have as a nation—to equip those we send to war and care for them when they come home.”,Joe Biden,27,2012-10
Democrats,"“We've cut taxes for everyone in the middle class—$3,600 for the average family.”—VP Biden in North Carolina",Joe Biden,17,2012-10
Democrats,"VP in NC: “They say they value education, but they make massive cuts in education—in early education, elementary, and secondary education.”",Joe Biden,21,2012-10
Democrats,"“They say they value children and the elderly, but their budget slashes 19 million people off of Medicaid.”—VP Biden on Romney-Ryan",Joe Biden,21,2012-10
Democrats,VP Biden on Romney-Ryan: “Their plan would immediately cut benefits for 48 million seniors already on Medicare.”,Joe Biden,17,2012-10
Democrats,"“Under President Obama's leadership, Medicare benefits have actually increased. For prescription drugs, they've increased by $800.”—VP Biden",Joe Biden,17,2012-10
Democrats,"""The middle class was buried by the policies that Romney and Ryan have supported.""—VP Biden in Asheville, NC",Joe Biden,18,2012-10
Democrats,President Obama and Vice President Biden have a plan to move the economy forward—check it out: http://t.co/jajClfWp,Joe Biden,17,2012-10
Democrats,VP Biden made clear in his remarks today that Romney-Ryan would take us back to the failed Bush policies that crashed our economy.,Joe Biden,23,2012-10
Democrats,Don’t forget to RSVP for a debate watch party near you! http://t.co/PJBBvP8b http://t.co/sHhxjlJL,Joe Biden,13,2012-10
Democrats,VP Biden got a sunny welcome in the Sunshine State over the weekend: http://t.co/ek99R0By,Joe Biden,14,2012-10
Democrats,"Bonus! After the debate, VP Biden will speak to supporters at watch parties. Don't miss it: http://t.co/XFRhrk3y",Joe Biden,17,2012-10
Democrats,Cheer on President Obama in Wednesday’s first debate at a supporter watch party in your neighborhood: http://t.co/WhoxtXhC,Joe Biden,17,2012-10
Democrats,Thanks to everyone who pitched in to help this campaign start strong in October: http://t.co/TEo7qX79,Joe Biden,15,2012-10
Democrats,"“Hello, this is Joe”: http://t.co/NMFORWaU",Joe Biden,5,2012-10
Democrats,Pitch in $5 before midnight to power this campaign when it matters most: http://t.co/i0uIDXwL http://t.co/YqZG2c5Y,Joe Biden,15,2012-09
Democrats,"One-on-one in Boca Raton, FL: http://t.co/2YCJu5Sm",Joe Biden,6,2012-09
Democrats,"VP Biden stood up for protecting Social Security and Medicare in Tamarac, Florida yesterday: http://t.co/7iQNokQs",Joe Biden,15,2012-09
Democrats,Make sure your grandparents know: Romney could raise taxes on their Social Security benefits. http://t.co/Wcbui1Cu,Joe Biden,15,2012-09
Democrats,Just 6 weekends left till Election Day—get out there for a Weekend of Action event near you: http://t.co/E1I94P9w,Joe Biden,18,2012-09
Democrats,“I’ve got news for Governor Romney and Congressman Ryan: America and Americans are neither dependent nor are we in decline.”—VP Biden,Joe Biden,21,2012-09
Democrats,"VP in FL: “The American people are so much better, so much stronger, take so much more responsibility than these guys give them credit for.”",Joe Biden,25,2012-09
Democrats,"VP Biden: “My dad used to say, Joey, I don’t expect the government to solve my problems, but I do expect them to understand my problems.”",Joe Biden,26,2012-09
Democrats,"VP on the Romney-Ryan Medicare plan: “You’d have to reach into your pocket and come up with another $6,400 a year.”",Joe Biden,21,2012-09
Democrats,“The action that the President took with regard to Medicare has made the system solvent … through 2024.”—VP Biden in Florida,Joe Biden,21,2012-09
Democrats,VP Biden: “Just look at the facts. President Obama has increased the benefits available to people on Medicare today by the action he took.”,Joe Biden,24,2012-09
Democrats,VP Biden on Romney’s plan: “The average senior would have to pay $460 more in taxes for their Social Security.” http://t.co/sPE9uPUq,Joe Biden,21,2012-09
Democrats,Mitt Romney’s tax plan could lead to higher costs for seniors—send an eCard to spread the word: http://t.co/oSKjWAY0,Joe Biden,18,2012-09
Democrats,VP Biden is in Florida today to talk about the stark choice on Social Security in this election. Get the facts: http://t.co/vHOF5odq,Joe Biden,22,2012-09
Democrats,VIDEO: President Obama’s plan for creating jobs and strengthening the middle class. http://t.co/YShaaNzK,Joe Biden,13,2012-09
Democrats,40 days. Let’s do this thing. http://t.co/ki0Nga0r http://t.co/t7BjtPis,Joe Biden,8,2012-09
Democrats,The best thing you’ll read today: http://t.co/mqiZ0OII,Joe Biden,7,2012-09
Democrats,"Fired up, ready for Joe in Chesterfield, VA: http://t.co/fXptjksG",Joe Biden,9,2012-09
Democrats,The choice on women’s health couldn’t be clearer: http://t.co/VUBolMN0,Joe Biden,9,2012-09
Democrats,"Registering to vote takes less than 5 minutes. Do it today, then spread the word: http://t.co/UCLAXnZn",Joe Biden,16,2012-09
Democrats,"VP: “I’ve got news for Gov. Romney and Congressman Ryan: Gentlemen, it has never, ever been a good bet to bet against the American people.”",Joe Biden,25,2012-09
Democrats,"“We owe those of you who served, we owe the families of those who have served, an incredible debt.”—VP Biden in Virginia",Joe Biden,22,2012-09
Democrats,VP: “How could Gov. Romney and Congressman Ryan have such a profound misunderstanding of who the American people are?”,Joe Biden,19,2012-09
Democrats,“We don’t think it is a culture of dependency when a 27-year-old couple with a couple of kids gets a child care tax credit.”—VP Biden,Joe Biden,25,2012-09
Democrats,VP: “We do not think it creates a culture of dependency when a 79-year-old widow living alone has access to Medicare and Social Security.”,Joe Biden,24,2012-09
Democrats,"“Instead of attacking folks who work for a living and pay their way, Romney should be respecting their hard work.”—VP Biden",Joe Biden,21,2012-09
Democrats,"“They turn Medicare into a voucher system, and they put insurance companies back in control of your health.”—VP Biden on Romney-Ryan",Joe Biden,21,2012-09
Democrats,On Romney-Ryan: “Their budget calls for massive cuts to education. They cut $4.9 billion in 1 year out of elementary &amp; secondary education.”,Joe Biden,23,2012-09
Democrats,VP on the GOP: “They say they care about the middle class. Isn’t it amazing how they discovered the middle class at their convention?”,Joe Biden,24,2012-09
Democrats,"“We put forward a concrete plan to cut the debt by $4 trillion in the next 10 years.”—Vice President Biden in Chesterfield, VA",Joe Biden,23,2012-09
Democrats,"Don't wonder ""what if""—give Dinner with Barack a shot before this great campaign tradition comes to an end. http://t.co/56XISaZB",Joe Biden,19,2012-09
Democrats,A favorite Joe photo: http://t.co/0GWBE8aa,Joe Biden,5,2012-09
Democrats,Get a free Obama-Biden car magnet in 3 easy steps: http://t.co/HWfU18jM http://t.co/5dbukpXt,Joe Biden,12,2012-09
Democrats,"Before voting even starts, Romney’s already written off half the country. Be part of the team that fights for everyone: http://t.co/invfbJhl",Joe Biden,21,2012-09
Democrats,Check out some highlights from the VP’s trip to New Hampshire—then commit to vote: http://t.co/ED5yteKU,Joe Biden,15,2012-09
Democrats,Connect with the campaign on Facebook and get a free Obama-Biden car magnet! http://t.co/ZLohF0cE,Joe Biden,14,2012-09
Democrats,Touchdown Joe: http://t.co/sYgvdnlh,Joe Biden,3,2012-09
Democrats,"Grins in Dartmouth, New Hampshire: http://t.co/wIGxlMqI",Joe Biden,6,2012-09
Democrats,"“This is not a country of victims. This is a country where when people get knocked down, they get back up.” #VPinNH",Joe Biden,22,2012-09
Democrats,"“We see a future where everyone—everyone, rich and poor—does their part and has a part.”—VP Biden",Joe Biden,16,2012-09
Democrats,"Written off by Romney: “9 million children, young adults from working-class families, who are in college because of Pell Grants.”",Joe Biden,20,2012-09
Democrats,Written off by Romney: “The 63-year-old Vietnam War veteran who goes to the VA hospital once a week to get help and treatment.”,Joe Biden,23,2012-09
Democrats,"Among those Romney disdained: “The 78-year-old widow living on Social Security and Medicare, which she worked her whole life to earn.”",Joe Biden,21,2012-09
Democrats,"VP on Romney’s 47% comment: “Let’s take a look at the people who they think he has no responsibility toward, or who are dependent.”",Joe Biden,24,2012-09
Democrats,“I believe he genuinely believes that nearly half this country is made up of people who see themselves as victims.”—VP Biden on Romney,Joe Biden,23,2012-09
Democrats,“We are certain we will meet the goal in this country of once again having the highest percentage of college graduates by 2020.” #VPinNH,Joe Biden,24,2012-09
Democrats,VP Biden: “We’ve invested in early education to eliminate the achievement gap before kids hit second grade.”,Joe Biden,17,2012-09
Democrats,“We capped student loan repayments at 10 percent of your disposable income. It matters in what you’ll be able to do.”—VP Biden,Joe Biden,22,2012-09
Democrats,“Jill has an expression: Any nation that out-educates us will out-compete us. It means we must be the best-educated nation in the world.”,Joe Biden,23,2012-09
Democrats,VP Biden stands up for the 47% of Americans who Romney wrote off this week: http://t.co/rcJ8dPWi,Joe Biden,16,2012-09
Democrats,VP Biden: “The President and I have a fundamentally different vision for this country and a fundamentally different value set.”,Joe Biden,20,2012-09
Democrats,How the Bidens do fall (with a 36-pound pumpkin): http://t.co/qvCfv0lZ,Joe Biden,10,2012-09
Democrats,"One year ago today, President Obama ended “Don’t Ask, Don’t Tell"": http://t.co/dkTgYnwz",Joe Biden,12,2012-09
Democrats,You've got to get involved—we've got the last Dinner with Barack of this campaign coming up: http://t.co/vXv9T3y7,Joe Biden,17,2012-09
Democrats,"Grabbing a bite in Muscatine, Iowa: http://t.co/5FWSbVTm",Joe Biden,7,2012-09
Democrats,Check out the highlights from Dr. Jill Biden’s trip to colleges in Minnesota and Pennsylvania last week: http://t.co/WUrFsJrE,Joe Biden,18,2012-09
Democrats,Pass it on: http://t.co/CMqZ5hj2,Joe Biden,4,2012-09
Democrats,"PHOTOS: With just eight days to go until early voting starts in Iowa, VP Biden found folks fired up and ready to go. http://t.co/aHUBmbgV",Joe Biden,24,2012-09
Democrats,Join Americans of faith who are supporting @BarackObama: http://t.co/ED4u9a0Q,Joe Biden,9,2012-09
Democrats,Pumpkin time means it’s voting season in the Hawkeye State: http://t.co/eUhTy0uv,Joe Biden,11,2012-09
Democrats,Watch Gloria’s story—it’s powerful stuff: http://t.co/K5bHn04D,Joe Biden,6,2012-09
Democrats,VP in Iowa: “It's time to stand up for the middle class.  And you can start moving in that direction in 10 days when early voting starts.”,Joe Biden,27,2012-09
Democrats,“I don't live in a country that's dependent or declining. There is no give-up anywhere in America.”—VP Biden,Joe Biden,18,2012-09
Democrats,VP: “The President and I have a different way forward. We know the way to create jobs is the old-fashioned way—from the middle out.”,Joe Biden,24,2012-09
Democrats,VP Biden on Romney: “He is totally out of touch with the reality of what ordinary Americans deal with every day. He does not get it.”,Joe Biden,26,2012-09
Democrats,VP Biden in IA: “The President has brought more trade cases against China in one term than the Bush administration did in eight years.”,Joe Biden,24,2012-09
Democrats,"“President Obama understands that creating jobs here, keeping jobs here, bringing jobs back to America, that's the job of the President.”",Joe Biden,21,2012-09
Democrats,"On Romney’s jobs plan: “It will create 800,000 jobs—all of them overseas—and we’re being lectured by this guy about getting tough on China?”",Joe Biden,23,2012-09
Democrats,"VP on Romney (2/2): “The President won that case. As a consequence, 1,000 workers are making tires in this country and earning a good wage.”",Joe Biden,25,2012-09
Democrats,"VP on Romney (2/2): “The President won that case. As a consequence, 1,000 workers are making tires in this country and earning a good wage.”",Joe Biden,25,2012-09
Democrats,VP on Romney (1/2): “He called the President a protectionist for stepping up and stopping an unfair surge of Chinese automobile tires.”,Joe Biden,22,2012-09
Democrats,VP in Iowa: “Isn’t it great having a President who thinks it matters whether or not there’s still an auto industry in the United States?”,Joe Biden,25,2012-09
Democrats,50 days left till the election—sign up to make a difference now: http://t.co/O7r8tR7Q,Joe Biden,13,2012-09
Democrats,Just a few ways President Obama is moving this country forward: http://t.co/mp5MWqZJ,Joe Biden,12,2012-09
Democrats,Join Dr. Jill Biden as a woman for Obama: http://t.co/kszOwwe9,Joe Biden,10,2012-09
