Political Affiliation,tweet,Politician,Word Count,created_time
Democrats,Join me in Pittsburgh tomorrow for a discussion on my plan to build a middle class where everyone comes along. RSVP to let me know you’ll be there: https://t.co/WLKs9xmHM7,Joe Biden,29,2019-04
Democrats,"Iowa, I'm headed to town this week! Let me know you'll join us by RSVPing at https://t.co/NdJwunC2kP https://t.co/8i6GPQKV6x",Joe Biden,18,2019-04
Democrats,"Dick Lugar was among the most decent men I have ever known. Kind, loyal, dedicated beyond measure to the service of the American people. Dick Lugar was my dear friend. 

Jill and I send our condolences to his wife Charlene and the entire Lugar family.",Joe Biden,45,2019-04
Democrats,"Wishing everyone in the Orthodox Christian community a peaceful and joyful Easter celebration with friends, family and loved ones. God Bless.",Joe Biden,21,2019-04
Democrats,"Jill and I are devastated to hear about today’s shooting at the Chabad Poway synagogue. No one should have to worship in fear.

As a country, we must speak out against bigotry and gun violence. We’re in the battle for the soul of this nation—and it’s on all of us to act.",Joe Biden,52,2019-04
Democrats,I have a message for #TeamJoe: Thank you! https://t.co/j61zCaZmDz,Joe Biden,9,2019-04
Democrats,I had the privilege to thank one of our grassroots donors. It's because of supporters like Josh we're able to make this campaign a reality and bring this country together. https://t.co/afNTBQb4xB,Joe Biden,31,2019-04
Democrats,"Thank you to the women of @TheView for the conversation today. It’s always a pleasure to sit down with you at the table. #TheView 

Credit: ABC/Lorenzo Bevilaqua https://t.co/lRNMXwslDw",Joe Biden,28,2019-04
Democrats,Looking forward to joining the women of @TheView today for my first live interview since announcing my 2020 campaign for President. Tune in 11e|10c|p on @ABCNetwork. #TheView,Joe Biden,27,2019-04
Democrats,UPDATE: We’re about to close the books on an AMAZING first day of our campaign. It’s not too late to be a part of it. Chip in before midnight to be a Day One donor. https://t.co/yniXNJl7ia #Joe2020 https://t.co/MmDdyUsHZh,Joe Biden,38,2019-04
Democrats,"Our campaign is off to a great start thanks to thousands of Americans who have made donations. If you haven’t had the chance just yet, I hope you will join us too! Head to https://t.co/yniXNJl7ia to make a donation today. #Joe2020",Joe Biden,41,2019-04
Democrats,"Folks, earlier today I announced that I’m running for President of the United States. The strength of this movement depends on you. Head over to https://t.co/yniXNJl7ia to make a donation today. #Joe2020",Joe Biden,32,2019-04
Democrats,"Our country is being put to the test, but I’ve never been more optimistic about America. Together we can do this. Make a Day One donation to join us. https://t.co/xfD5pLtmAf #Joe2020 https://t.co/UbLPMfE8Ui",Joe Biden,32,2019-04
Democrats,"Hoy estoy anunciando mi candidatura para presidente de los Estados Unidos. Somos los Estados Unidos de America - y juntos no hay nada que no podamos hacer. Únete a nuestra campaña: https://t.co/9MBT8Qkyzd
#Joe2020 https://t.co/GhSYDci4dr",Joe Biden,34,2019-04
Democrats,The core values of this nation… our standing in the world… our very democracy...everything that has made America -- America --is at stake. That’s why today I’m announcing my candidacy for President of the United States. #Joe2020 https://t.co/jzaQbyTEz3,Joe Biden,38,2019-04
Democrats,"The hard working men and women of @UFCW that I met today are going without pay during this strike. If you can, pitch in to make sure that those workers facing the greatest hardship are supported. https://t.co/49JkqJG1Cu",Joe Biden,37,2019-04
Democrats,My wife Jill always reminds me that any country that out-educates us will out-compete us. Our teachers must have the resources they need &amp; the wages they deserve so that America will continue to lead the world. Great speech today on this from @rweingarten. https://t.co/aaU10GNjOB,Joe Biden,45,2019-04
Democrats,"I'm on my way up to a rally at #StopandShop in Boston to stand with some of the 31,000 @UFCW union members who are currently fighting against cuts to wages and health care for themselves and their families. Stand with us: https://t.co/D4baO7D5xH",Joe Biden,42,2019-04
Democrats,"For centuries, Notre Dame Cathedral has withstood wars, revolutions, and the test of time. It is a symbol of faith &amp; a testament to history. And even as our hearts break to see it burn today during the holiest week of the year for Catholics, I have faith that it will rise again.",Joe Biden,53,2019-04
Democrats,This is powerful. I would encourage everyone to read and take to heart Kyle’s message on privilege. https://t.co/Kceif5wFvg,Joe Biden,18,2019-04
Democrats,"In the last 5 years, @StopandShop's parent company has bought back billions of dollars in stock. Now they want to cut employee wages &amp; benefits. This is wrong. I stand with the 31,000 @UFCW workers fighting for their healthcare. Join me and support them: https://t.co/D4baO7D5xH",Joe Biden,45,2019-04
Democrats,https://t.co/WiA0Ux3aYE,Joe Biden,1,2019-04
Democrats,"I see that you are on the job and presidential, as always. https://t.co/j7wh3opXOv",Joe Biden,13,2019-04
Democrats,"Social norms are changing. I understand that, and I’ve heard what these women are saying. Politics to me has always been about making connections, but I will be more mindful about respecting personal space in the future. That’s my responsibility and I will meet it. https://t.co/Ya2mf5ODts",Joe Biden,46,2019-04
Democrats,"Stoning people to death for homosexuality or adultery is appalling and immoral. Every single person on earth is entitled to be treated with dignity and to live without fear. There is no excuse—not culture, not tradition—for this kind of hate and inhumanity. https://t.co/g208NzeS7l",Joe Biden,43,2019-03
Democrats,.@NRA opposition to a full reauthorization of the Violence Against Women Act is sickening. We must do more to protect victims of stalking and abuse. It makes no sense to allow those who perpetrated the abuse to have access to deadly firearms. We must stand up now for survivors.,Joe Biden,49,2019-03
Democrats,"Whether on the assembly line, at the grocery store checkout, or in the boardroom, every woman deserves to make every penny a man doing the same job makes. The #PaycheckFairnessAct will help us get there. Congratulations @rosadelauro and thank you for your leadership on this.",Joe Biden,45,2019-03
Democrats,"I was honored to meet Vlad and Adrianna tonight at the #BidenCourageAwards. These young people exemplify what @ItsOnUs is all about. I hope their bravery inspires more to take action to change our culture.

Join these leaders and sign the #ItsOnUs pledge: https://t.co/7yB47THGYQ",Joe Biden,43,2019-03
Democrats,"I’m proud of my alma mater @UDelaware &amp; the student organizers of @UDance for their commitment to fighting childhood cancer. 

Today, they are hosting a 12 hour dance marathon benefiting the @BePositiveFdn. Join me in supporting this worthy cause.
https://t.co/d69oDCAgzL",Joe Biden,40,2019-03
Democrats,"The people of Guatemala should be the ones to choose their next president. The stakes are high: promoting transparency, shared prosperity, and combating corruption. For this reason, the @TSEGuatemala needs to certify all eligible presidential candidates by the Sunday deadline.",Joe Biden,40,2019-03
Democrats,Silence is complicity. Our children are listening. The time to speak out is now.,Joe Biden,14,2019-03
Democrats,"Whether it is antisemitism in Pittsburgh, racism in Charlottesville, or the xenophobia and Islamophobia today in Christchurch, violent hate is on the march at home and abroad. We cannot stand by as mosques are turned into murder scenes.",Joe Biden,38,2019-03
Democrats,"On behalf of Jill, myself, and all of the Bidens, our hearts go out to the community in Christchurch suffering from today’s senseless violence. Friday prayers for those who were gathered at their mosques has seen families torn apart by hate.",Joe Biden,41,2019-03
Democrats,"No one should live in fear of being fired, evicted from their home, or denied service in a restaurant just because of their gender identity or who they love. The #EqualityAct is long overdue, and will ensure LGBTQ Americans are treated with the dignity and respect they deserve.",Joe Biden,48,2019-03
Democrats,https://t.co/SOZ9EUh854,Joe Biden,1,2019-03
Democrats,"Joe Boardman led @Amtrak through difficult times, taking over during the worst economic crisis since the Depression, and starting a modernization that will help deliver the 21st century rail system America deserves. My thoughts are with his wife Joanne and their family.",Joe Biden,42,2019-03
Democrats,"Each year on International Women’s Day, we reaffirm the straightforward truth that achieving the goal of full and equal rights for women is essential to the success of all our nations.

More on #IWD2019 here: https://t.co/TVl24g71Bi",Joe Biden,36,2019-03
Democrats,"@CynthiaNixon You’re right, Cynthia. I was making a point in a foreign policy context, that under normal circumstances a Vice President wouldn’t be given a silent reaction on the world stage. 

But there is nothing decent about being anti-LGBTQ rights, and that includes the Vice President.",Joe Biden,46,2019-02
Democrats,Notes are ready. Be sure to tune in at 3pm ET when I will sit down at @UDBidenSchool with author and historian @jmeacham to talk about his book “The Soul of America” and the state of our democracy today. https://t.co/3F6qAEE3qA https://t.co/irisDJmDLu,Joe Biden,41,2019-02
Democrats,"Foreign election interference is not only a serious threat to our democratic institutions, it’s a threat to our national security. Russia and other authoritarian regimes are actively seeking to try to change outcomes of our democratic elections, and we can’t allow that to happen. https://t.co/9hFF6sHCQ5",Joe Biden,45,2019-02
Democrats,"Today I congratulated President @IvanDuque on his successful visit to Washington. Maintaining strong bipartisan support for #Colombia is vitally important to meeting key security and economic challenges in the hemisphere, including humanitarian aid for refugees from #Venezuela.",Joe Biden,37,2019-02
Democrats,"Stand with survivors and advocates like @nguyen_amanda, @ZerlinaMaxwell, @ruthmglenn, @DavidsonJess22, @Mariska, and so many others. Reauthorize VAWA now.",Joe Biden,18,2019-02
Democrats,"There is nothing more powerful that Congress can do to help women, strengthen families, and save lives than reauthorizing VAWA. Now.",Joe Biden,21,2019-02
Democrats,"VAWA’s power is that it gets stronger with each reauthorization. This year can be no different. Like was done in 2000 and 2005 and 2013, we must expand the reach of VAWA to respond to the needs of survivors at risk every day.",Joe Biden,43,2019-02
Democrats,"One in five women will still be victims of rape or attempted rape in their lifetimes. On average, three women a day are murdered by their husbands or boyfriends. Nothing is more urgent than reauthorizing and expanding the law that makes women safer.",Joe Biden,43,2019-02
Democrats,"Since the passage of VAWA, annual rates of domestic violence have dropped by 63%. The National Domestic Violence Hotline responds to more than 26,000 people a month, creating a safety net for survivors. We have made progress, but there is much more to do. Right now.",Joe Biden,46,2019-02
Democrats,"Since the passage of VAWA, annual rates of domestic violence have dropped by 63%. The National Domestic Violence Hotline responds to more than 26,000 people a month, creating a safety net for survivors. We have made progress, but there is much more to do. Right now.",Joe Biden,46,2019-02
Democrats,"When I wrote the Violence Against Women Act in 1994, I believed it would be a lifeline. But this Congress has turned it into a political football. It’s time to pass a strong reauthorization to the Violence Against Women Act. No more stalling. Lives are on the line.",Joe Biden,48,2019-02
Democrats,"I know from personal experience the only way to overcome grief is to find purpose. The Parkland students &amp; families will not allow us to turn away from our responsibilities to those 17 fallen angels. We aren’t there yet, but with their determination &amp; insistence, we’ll get there.",Joe Biden,48,2019-02
Democrats,"One year after the tragic massacre in Parkland, we’ve not done nearly enough to ensure this will never happen again. In the last year far too many have died from gun violence. But I have hope. #MSDStrong",Joe Biden,37,2019-02
Democrats,Only a tyrant would prevent the delivery of food and medicine to people he claims to lead. The international community must support Juan Guaido and the National Assembly. It is time for Maduro to step aside and allow a democratic transition. The Venezuelan people deserve better.,Joe Biden,46,2019-02
Democrats,John Dingell was the Dean of the House. He earned that title — not just because he was there the longest — but because he led with great moral courage and vision. He was a friend and I will miss him terribly. Debbie is in my prayers.,Joe Biden,47,2019-02
Democrats,Stacey Abrams achieved in a matter of minutes something Donald Trump failed to do in over an hour -- to embrace and give voice to the spirit and core values that make America great.,Joe Biden,34,2019-02
Democrats,"Today far too many transgender youth continue to face rejection at home and discrimination in their communities. Check out the work @bidenfoundation is doing with @lgbtmap and @genderspectrum to support these young people: https://t.co/TxMLXge8vh 
#AdvancingAcceptance",Joe Biden,35,2019-02
Democrats,"There is no place for racism in America. Governor Northam has lost all moral authority and should resign immediately, Justin Fairfax is the leader Virginia needs now.",Joe Biden,27,2019-02
Democrats,This country is built on the courage of ordinary Americans who stand up for what’s right. I couldn’t be prouder to stand alongside the young leaders fighting tooth and nail to protect Title IX.,Joe Biden,34,2019-02
Democrats,"Through the #HandsOffIX website, @endrapeoncampus,@knowyourIX have helped thousands make their voices heard in the notice and comment process. https://t.co/EBBlWMQ5ex",Joe Biden,19,2019-02
Democrats,"Fellow @UDelaware Blue Hen @Sage_Gaea of @knowyourIX has done so much for the students of Delaware through her advocacy, and is now fighting for students across the country.",Joe Biden,28,2019-02
Democrats,".@DavidsonJess22 of @endrapeoncampus has been advocating for safer campuses since long before I met her in the White House. Jess, I’m so grateful for your tireless work, and proud of all that you continue to accomplish. https://t.co/FxESpdGMx6",Joe Biden,37,2019-02
Democrats,Students and survivors are making their voices heard. Grassroots organizers are working to make sure these guidelines are never put into effect.,Joe Biden,22,2019-02
Democrats,"This week @bidenfoundation submitted a comment to the Department of Education about proposed changes to #TitleIX guidance.

These new rules would endanger students and make it harder for survivors of sexual assault to seek justice. https://t.co/qEV7z3Ewpx",Joe Biden,36,2019-02
Democrats,"What happened today to @JussieSmollett must never be tolerated in this country. We must stand up and demand that we no longer give this hate safe harbor; that homophobia and racism have no place on our streets or in our hearts. We are with you, Jussie. https://t.co/o8ilPu68CM",Joe Biden,47,2019-01
Democrats,https://t.co/iYah5x11To,Joe Biden,1,2019-01
Democrats,"An untested rape kit means a survivor without justice. I wrote the first rape kit backlog law because every survivor deserves closure, and because evidence shows testing kits can identify men who have committed multiple rapes - and might again. Test every kit. Every single one.",Joe Biden,46,2019-01
Democrats,The spirit of Dr. King is still with us. It has burrowed deep into the soul of this nation. It will not let us rest. On #MLKDay we must heed Dr. King’s admonition from his final sermon and do our part to “make America what it ought to be.”,Joe Biden,49,2019-01
Democrats,"Congratulations to the two women who led the way: @RepLonghurst and @HansenForSenate, as well as all of the lawmakers, activists, and citizens who made this happen.",Joe Biden,26,2019-01
Democrats,"“Equality of rights under the law shall not be denied or abridged on account of sex.” 

Another step forward for equality and basic dignity in Delaware tonight, as the Equal Rights Amendment is enshrined in our state’s Constitution.",Joe Biden,38,2019-01
Democrats,"White supremacists and their shameful ideology should have no place in this country in 2019, let alone a voice of sympathy in the United States Congress. https://t.co/SNZD8wt7V6",Joe Biden,27,2019-01
Democrats,"I know I’m a little biased, but this post from Jill @DrBiden in the #BidenForum is a must-read. Her story of the strong middle-class values that shaped her is America’s story. And she tells it so well. https://t.co/RbsmCOGRv5",Joe Biden,38,2018-12
Democrats,It is clear this administration has abandoned those core American beliefs. Secretary Mattis’ presence and his voice of reason and experience will be missed in the Pentagon and the Situation Room.,Joe Biden,31,2018-12
Democrats,"I’ve had disagreements with Secretary Mattis, but we shared the view — long-held by Democrats and Republicans in this nation — that respect for our allies and a commitment to the most important and effective alliances in history made America safer.",Joe Biden,41,2018-12
Democrats,"Friends don't let friends go uninsured. If you still need health insurance for 2019, tomorrow, December 15th, is the last day to get it through https://t.co/2Ls3d80By6. This is about your health and peace of mind for you and your loved ones — there's nothing more important. https://t.co/hnXCRbOiOZ",Joe Biden,47,2018-12
Democrats,"This summer, the @bidenfoundation asked you to share stories about the importance of family and community acceptance for #LGBTQ young people. Here’s what you’ve said so far: https://t.co/o3NTnmNzH1",Joe Biden,28,2018-12
Democrats,Now that’s more like it. https://t.co/w34Lo9Ods3,Joe Biden,6,2018-12
Democrats,"President George H.W. Bush was a decent, kind, and gracious statesman. This nation will miss him. Our condolences go out to the entire Bush family for their loss. https://t.co/vF2qRPm4by",Joe Biden,29,2018-12
Democrats,"Grateful for the time spent with loved ones this Thanksgiving, and grateful for the sacrifice of those military families whose loved ones are on duty, unable to be with their families. From our family to yours, Happy Thanksgiving.",Joe Biden,38,2018-11
Democrats,"Betsy DeVos’ new Title IX rules will discourage sexual assault reporting and investigations. When 1 in 5 women experience sexual assault while in college, we can’t afford to go backwards. Share your views: https://t.co/eSsO7c9yXD",Joe Biden,34,2018-11
Democrats,"The fires continue to burn in California, and our firefighters are among those who are losing everything. Right now, no matter where you live, you can help. Please give to support firefighters who have lost their homes to the wildfires: https://t.co/BwM7gzZAjw",Joe Biden,41,2018-11
Democrats,"Instead of saying every legal vote should be counted in Florida, Republicans have adopted a strategy to discredit the process. 

It’s wrong – and it’s dangerous. 

Count every single lawful vote. Count them fairly. Count them transparently. https://t.co/9pANgOv2dY",Joe Biden,38,2018-11
Democrats,Congratulations to @kyrstensinema for a well-earned victory tonight. She’s going to do incredible work for Arizona. Credit to @MarthaMcSally as well for handling the results with true dignity and class.,Joe Biden,30,2018-11
Democrats,"Every military family knows what it means to sacrifice. Every individual life and story matters. It is who we are as Americans. 

On #VeteransDay and every day we must stand up for the men and women who put their lives on the line to defend us.",Joe Biden,46,2018-11
Democrats,"It’s the most fundamental American right: the right to vote — and for your vote to be counted. Count all the votes in Florida, Georgia, and Arizona. Count them fairly. Count them transparently.",Joe Biden,33,2018-11
Democrats,There's still time to take this election into your own hands. Don't regret what you could have done—take action right now: https://t.co/hPaGx4kLyA,Joe Biden,22,2018-11
Democrats,"No better time to help get out the vote than right now—whether you have a lunch break or a few hours to spare, take back our democracy at an event near you: https://t.co/hPaGx4kLyA",Joe Biden,33,2018-11
Democrats,"So let's do this. Get out there and vote today. Here's an easy place to confirm where you can vote, check voting hours, and find out if you need to bring anything with you. It's time. https://t.co/8XWNjhOkYl",Joe Biden,37,2018-11
Democrats,"Today is #ElectionDay, and this election is bigger than politics. Today we have a chance to reclaim our American ideals and take this country back. https://t.co/OlrEFfM9D7",Joe Biden,26,2018-11
Democrats,"The work we began that night ten years ago in Grant Park is unfinished. 

If you still believe, as I do, that hope is more powerful than fear, then show up and vote. And bring five people with you. https://t.co/SOLx6WfZjL",Joe Biden,40,2018-11
Democrats,"You don’t need to be a Vice President or a podcast star to to make a difference in this election. 

Volunteer now, knock on some doors, and make sure you show up to vote this Tuesday. https://t.co/ErWycs1ORg",Joe Biden,37,2018-11
Democrats,"Voting restrictions in Georgia weren’t meant to protect the sanctity of our vote, but to suppress turnout. I applaud the court rulings to overturn them and right these wrongs. 

We should be making voting easier, not harder. Now let’s prove nothing can stop us. Vote. https://t.co/utgGhoJzGQ",Joe Biden,46,2018-11
Democrats,"The character of our country is on the ballot on Tuesday, but you still have a chance to make a difference today. Don't just vote -- volunteer on #TheLastWeekend. It's that important. https://t.co/nw9I8WfFK1 https://t.co/0mvuVFh9aX",Joe Biden,34,2018-11
Democrats,I couldn’t be more excited to close out this election in Luzerne County PA on Sunday at a Get Out the Vote rally with my friends @Bob_Casey and @CartwrightPA. Join us: https://t.co/hwTVp2rwU3,Joe Biden,32,2018-11
Democrats,"This Thursday evening I’ll be in Lansing, Michigan to support @ElissaSlotkin, Debbie @Stabenow, @GretchenWhitmer and @Garlin. RSVP to join us: https://t.co/Scf8QXozYU",Joe Biden,21,2018-10
Democrats,"We can’t leave a single vote on the table, and we’ve got to do everything in our power to re-elect fantastic public servants like Senator @clairecmc.

So I'm heading to Missouri for a Get Out The Vote Rally tomorrow evening. Join us: https://t.co/Xq30zEESrx",Joe Biden,43,2018-10
Democrats,"I'm proud to support @Kelly4SouthrnIL. Brendan is tough, independent, and honest—the kind of leader and public servant that Southern Illinois needs. I'm excited to head to his district for a get out the vote really tomorrow—get info and RSVP here: https://t.co/LXR6bP5mRn",Joe Biden,41,2018-10
Democrats,I'll be in Cedar Rapids tomorrow with @Abby4Iowa and @FredHubbell to rally Iowans around reclaiming our democracy. Let us know you'll be there: https://t.co/wFg0smel1G,Joe Biden,24,2018-10
Democrats,"Ohio needs a champion—a Governor with a back bone—and that’s @RichCordray. He’s ready to fight for working families, and I’m ready to help him get elected. 

Join us in Youngstown tomorrow: https://t.co/AuIH5ny9I1",Joe Biden,32,2018-10
Democrats,"We desperately need men and women of character in elected office. That's why next Tuesday, one week out from Election Day, I'm proud to join @tammybaldwin &amp; @Tony4WI at early vote rallies. RSVP here: 

Madison: https://t.co/QSDArVzVQ1 

Milwaukee https://t.co/d7AjlNl55I",Joe Biden,38,2018-10
Democrats,"Together, we can take this country back. That's why I'm heading to Hartford on Friday in support of @NedLamont and @JahanaHayesCT. Don't miss this: 

https://t.co/gyLOEZ6eSf",Joe Biden,25,2018-10
Democrats,"What an honor to be joined by @Alyssa_Milano on tonight’s #ItsOnUs student organizing call. Alyssa, your courage reignited a movement, and your continued advocacy inspires me every day. Thank you.",Joe Biden,30,2018-10
Democrats,"This country has to come together. This division, this hatred, this ugliness has to end.",Joe Biden,15,2018-10
Democrats,"Cancer patients own their data, not hospitals. #CountMeIn empowers patients to contribute their data for research. To find cures.

We are changing the culture of cancer research — sharing data, breaking down silos, and forming new collaborations.  We can do this. https://t.co/EgLMFEMrhL",Joe Biden,42,2018-10
Democrats,"Our basic American values are under assault. But we can take this country back if we show up and vote. 

That's why I'm heading to Las Vegas on Saturday at 7:30am for the first day of early voting. 

RSVP here to say you’ll be there: https://t.co/VKKCTWpzve #RiseNVote",Joe Biden,47,2018-10
Democrats,"20 years have passed since the murder of young Matthew Shepard. We've come a long way, thanks to organizations like @MattShepardFDN, but our work isn’t done. We cannot stop fighting until every LGBTQ young person is affirmed, supported, and safe. #MSF20",Joe Biden,41,2018-10
